Unnamed-0,Unnamed-1,December-31,Unnamed-3
,2019,2018,2017
Balance at beginning of year,"$41,198","$29,938","$35,584"
Reductions based on tax positions related to prior year,(207),(820),"(6,335)"
Additions based on tax positions related to prior year,"9,562",263,108
Additions based on tax positions related to current year,"16,517","11,860","9,289"
Reductions due to tax authorities’ settlements,—,(43),"(8,603)"
Reductions due to expiration of statutes of limitation,(45),—,(105)
Balance at end of year,"$67,025","$41,198","$29,938"
